[
  {
    "id": 1,
    "firstName": "Alice",
    "lastName": "Smith",
    "email": "alice.smith@example.com",
    "status": "active",
    "createdAt": "2023-01-15T10:30:00Z"
  },
  {
    "id": 2,
    "firstName": "Bob",
    "lastName": "Johnson",
    "email": "bob.johnson@example.com",
    "status": "active",
    "createdAt": "2023-02-20T14:00:00Z"
  },
  {
    "id": 3,
    "firstName": "Charlie",
    "lastName": "Brown",
    "email": "charlie.brown@example.com",
    "status": "inactive",
    "createdAt": "2023-03-05T09:00:00Z"
  },
  {
    "id": 4,
    "firstName": "Diana",
    "lastName": "Prince",
    "email": "diana.prince@example.com",
    "status": "active",
    "createdAt": "2023-04-10T18:45:00Z"
  },
  {
    "id": 5,
    "firstName": "Ethan",
    "lastName": "Hunt",
    "email": "ethan.hunt@example.com",
    "status": "pending",
    "createdAt": "2023-05-25T12:00:00Z"
  }
]